{
  "audit_id": "NVIQ-GEMINI-LIVE-RUNTIME-FLOOR-P0-001",
  "customer_name": "Noct-Tech Internal Qualification",
  "target_name": "Gemini 3.8 Live Authenticated Floor Runtime",
  "target_version": "gemini-3.8-live",
  "created_at": "2026-09-28T00:00:00Z",
  "benchmark_version": "0.2",
  "case_set": "cases/v0.2/gemini-live-runtime-floor-p0.json",
  "tracks": [
    "audio_native"
  ],
  "evidence_sources": [
    {
      "evidence_id": "GEMINI-LIVE-AUTHENTICATED-FLOOR-RUNTIME",
      "kind": "trace",
      "ref": "out/gemini-live-floor-runtime/trace-manifest.json",
      "notes": "Authenticated Gemini Live provider session using independently synthesized PCM speech stimuli. No adapter fixture is accepted for this audit."
    }
  ],
  "retention_policy": {
    "raw_audio": "not_retained",
    "derived_artifacts_days": 30
  },
  "deployment_environment": "github_actions_authenticated_provider_runtime_espeak_stimuli",
  "notes": "Qualifies isolated automated synthesized-speech Conversational Floor Integrity sessions with transcription-overlap validity gating. Human natural-speech generalization is outside this receipt."
}
